{
  "type": "vertical",
  "bullets": [
    {
      "actionRefs": [
        3
      ]
    },
    {
      "actionRefs": [
        4
      ]
    },
    {
      "actionRefs": [
        5
      ]
    },
    {}
  ],
  "actions": [
    [
      {
        "actionRef": 1
      },
      {
        "actionRef": 2
      }
    ],
    [
      {
        "fireRef": {
          "ref": 0,
          "params": [
            120
          ]
        }
      },
      {
        "fireRef": {
          "ref": 0,
          "params": [
            240
          ]
        }
      },
      {
        "wait": 31
      },
      {
        "repeat": {
          "times": "5+$rank*20",
          "actionRef": 7
        }
      },
      {
        "wait": 100
      }
    ],
    [
      {
        "fireRef": 3
      },
      {
        "fireRef": 4
      },
      {
        "wait": 5
      }
    ],
    [],
    [
      {
        "changeSpeed": {
          "speed": {
            "type": "absolute",
            "value": 0.01
          },
          "term": 1
        }
      },
      {
        "actionRef": {
          "ref": 2,
          "params": [
            0
          ]
        }
      },
      {
        "actionRef": {
          "ref": 2,
          "params": [
            "8-$rank*4"
          ]
        }
      },
      {
        "actionRef": {
          "ref": 2,
          "params": [
            "16-$rank*8"
          ]
        }
      },
      {
        "vanish": true
      }
    ],
    [
      {
        "wait": 1
      },
      {
        "changeSpeed": {
          "speed": {
            "type": "absolute",
            "value": 0.02
          },
          "term": 2
        }
      },
      {
        "wait": 30
      },
      {
        "changeDirection": {
          "direction": {
            "type": "aim",
            "value": 0
          },
          "term": 1
        }
      },
      {
        "repeat": {
          "times": "77+$rank*306",
          "actionRef": 6
        }
      },
      {
        "vanish": true
      }
    ],
    [
      {
        "wait": 2
      },
      {
        "changeDirection": {
          "direction": {
            "type": "aim",
            "value": 0
          },
          "term": 30
        }
      },
      {
        "fireRef": {
          "ref": 1,
          "params": [
            0
          ]
        }
      },
      {
        "fireRef": {
          "ref": 1,
          "params": [
            20
          ]
        }
      },
      {
        "fireRef": {
          "ref": 1,
          "params": [
            -20
          ]
        }
      }
    ],
    [
      {
        "fireRef": 2
      },
      {
        "wait": 30
      }
    ]
  ],
  "fires": [
    {
      "direction": {
        "type": "absolute",
        "value": "$1"
      },
      "speed": {
        "type": "absolute",
        "value": 18.6
      },
      "bulletRef": 2
    },
    {
      "direction": {
        "type": "relative",
        "value": "$1"
      },
      "speed": {
        "type": "absolute",
        "value": 4.9
      },
      "bulletRef": 3
    },
    {
      "bulletRef": 1
    },
    {
      "direction": {
        "type": "relative",
        "value": "$1"
      },
      "speed": {
        "type": "absolute",
        "value": 2.3
      },
      "bulletRef": 0
    },
    {
      "direction": {
        "type": "relative",
        "value": "-$1"
      },
      "speed": {
        "type": "absolute",
        "value": 2.3
      },
      "bulletRef": 0
    }
  ]
}
