{
  "type": "vertical",
  "bullets": [
    {
      "speed": {
        "type": "absolute",
        "value": 0.5
      },
      "actionRefs": [
        1
      ]
    },
    {
      "actionRefs": [
        3
      ]
    },
    {},
    {},
    {}
  ],
  "actions": [
    [
      {
        "repeat": {
          "times": "10 + 10 * $rank",
          "actionRef": 5
        }
      },
      {
        "wait": 150
      }
    ],
    [
      {
        "wait": "30 * (2.0 - 1.0 * $rank)"
      },
      {
        "repeat": {
          "times": 999,
          "actionRef": 2
        }
      }
    ],
    [
      {
        "fireRef": 0
      },
      {
        "fireRef": 1
      },
      {
        "fireRef": 2
      },
      {
        "wait": "60 * (2.0 - 1.0 * $rank)"
      }
    ],
    [
      {
        "wait": "30 * (2.0 - 1.0 * $rank)"
      },
      {
        "repeat": {
          "times": 999,
          "actionRef": 4
        }
      }
    ],
    [
      {
        "fireRef": 3
      },
      {
        "fireRef": 4
      },
      {
        "wait": "60 * (2.0 - 1.0 * $rank)"
      }
    ],
    [
      {
        "fireRef": 5
      },
      {
        "fireRef": 6
      },
      {
        "wait": "30 * (2.0 - 1.0 * $rank)"
      }
    ]
  ],
  "fires": [
    {
      "direction": {
        "type": "relative",
        "value": 90
      },
      "speed": {
        "type": "absolute",
        "value": 1.1
      },
      "bulletRef": 1
    },
    {
      "direction": {
        "type": "relative",
        "value": -90
      },
      "speed": {
        "type": "absolute",
        "value": 1.1
      },
      "bulletRef": 1
    },
    {
      "direction": {
        "type": "aim",
        "value": "-10 + 20 * $rand"
      },
      "speed": {
        "type": "absolute",
        "value": 1.1
      },
      "bulletRef": 2
    },
    {
      "direction": {
        "type": "relative",
        "value": 30
      },
      "speed": {
        "type": "absolute",
        "value": "1.1 * (2 / 1.7320508)"
      },
      "bulletRef": 3
    },
    {
      "direction": {
        "type": "relative",
        "value": -30
      },
      "speed": {
        "type": "absolute",
        "value": "1.1 * (2 / 1.7320508)"
      },
      "bulletRef": 4
    },
    {
      "direction": {
        "type": "absolute",
        "value": 75
      },
      "speed": {
        "type": "absolute",
        "value": 1.1
      },
      "bulletRef": 0
    },
    {
      "direction": {
        "type": "absolute",
        "value": 255
      },
      "speed": {
        "type": "absolute",
        "value": 1.1
      },
      "bulletRef": 0
    }
  ]
}
