{
  "type": "horizontal",
  "bullets": [
    {
      "actionRefs": [
        1
      ]
    },
    {}
  ],
  "actions": [
    [
      {
        "repeat": {
          "times": 4,
          "actionRef": 3
        }
      }
    ],
    [
      {
        "repeat": {
          "times": 9999,
          "actionRef": 2
        }
      }
    ],
    [
      {
        "wait": 2
      },
      {
        "fireRef": 0
      }
    ],
    [
      {
        "repeat": {
          "times": "2+$rank*1.5",
          "actionRef": 4
        }
      },
      {
        "wait": 100
      }
    ],
    [
      {
        "fireRef": 1
      },
      {
        "wait": 45
      }
    ]
  ],
  "fires": [
    {
      "direction": {
        "type": "sequence",
        "value": 15
      },
      "bulletRef": 1
    },
    {
      "bulletRef": 0
    }
  ]
}
