{
  "type": "vertical",
  "bullets": [
    {
      "direction": {
        "type": "absolute",
        "value": 180
      },
      "speed": {
        "type": "absolute",
        "value": 2
      },
      "actionRefs": [
        1
      ]
    },
    {
      "actionRefs": [
        9
      ]
    },
    {},
    {},
    {},
    {},
    {},
    {},
    {}
  ],
  "actions": [
    [
      {
        "fireRef": 11
      },
      {
        "fireRef": 12
      },
      {
        "fireRef": 13
      },
      {
        "wait": "1050 - 150 * $rank"
      }
    ],
    [
      {
        "wait": 15
      },
      {
        "changeSpeed": {
          "speed": {
            "type": "absolute",
            "value": 0
          },
          "term": 1
        }
      },
      {
        "wait": 15
      },
      {
        "fireRef": 0
      },
      {
        "repeat": {
          "times": 3,
          "actionRef": 2
        }
      },
      {
        "wait": 20
      },
      {
        "repeat": {
          "times": 2,
          "actionRef": 3
        }
      },
      {
        "repeat": {
          "times": "200 / $3",
          "actionRef": 5
        }
      },
      {
        "vanish": true
      }
    ],
    [
      {
        "fireRef": 1
      }
    ],
    [
      {
        "fireRef": 2
      },
      {
        "repeat": {
          "times": 3,
          "actionRef": 4
        }
      },
      {
        "wait": 20
      }
    ],
    [
      {
        "fireRef": 3
      }
    ],
    [
      {
        "fireRef": 4
      },
      {
        "repeat": {
          "times": 3,
          "actionRef": 6
        }
      },
      {
        "repeat": {
          "times": 2,
          "actionRef": 7
        }
      },
      {
        "wait": "$3 * 3"
      }
    ],
    [
      {
        "fireRef": 5
      }
    ],
    [
      {
        "fireRef": 6
      },
      {
        "repeat": {
          "times": 3,
          "actionRef": 8
        }
      }
    ],
    [
      {
        "fireRef": 7
      }
    ],
    [
      {
        "wait": 15
      },
      {
        "changeSpeed": {
          "speed": {
            "type": "absolute",
            "value": 0.001
          },
          "term": 1
        }
      },
      {
        "wait": 1
      },
      {
        "changeDirection": {
          "direction": {
            "type": "relative",
            "value": "-(17 * $4)"
          },
          "term": 1
        }
      },
      {
        "wait": 1
      },
      {
        "wait": "200 - 100 * $rank"
      },
      {
        "changeSpeed": {
          "speed": {
            "type": "absolute",
            "value": 0.13
          },
          "term": 1
        }
      },
      {
        "wait": 1
      },
      {
        "fireRef": 8
      },
      {
        "wait": "$2"
      },
      {
        "repeat": {
          "times": "96 / $2",
          "actionRef": 10
        }
      },
      {
        "vanish": true
      }
    ],
    [
      {
        "repeat": {
          "times": 3,
          "actionRef": 11
        }
      },
      {
        "repeat": {
          "times": 3,
          "actionRef": 12
        }
      }
    ],
    [
      {
        "fireRef": 9
      },
      {
        "wait": "$2"
      }
    ],
    [
      {
        "fireRef": 10
      },
      {
        "wait": "$2"
      }
    ]
  ],
  "fires": [
    {
      "direction": {
        "type": "absolute",
        "value": "360 * $rand"
      },
      "speed": {
        "type": "absolute",
        "value": "$1"
      },
      "bulletRef": {
        "ref": 1,
        "params": [
          "$2",
          "$3",
          "$4",
          "$5"
        ]
      }
    },
    {
      "direction": {
        "type": "sequence",
        "value": 90
      },
      "speed": {
        "type": "absolute",
        "value": "$1"
      },
      "bulletRef": {
        "ref": 1,
        "params": [
          "$2",
          "$3",
          "$4",
          "$5"
        ]
      }
    },
    {
      "direction": {
        "type": "sequence",
        "value": 30
      },
      "speed": {
        "type": "absolute",
        "value": "$1"
      },
      "bulletRef": {
        "ref": 1,
        "params": [
          "$2",
          "$3",
          "$4",
          "$5"
        ]
      }
    },
    {
      "direction": {
        "type": "sequence",
        "value": 90
      },
      "speed": {
        "type": "absolute",
        "value": "$1"
      },
      "bulletRef": {
        "ref": 1,
        "params": [
          "$2",
          "$3",
          "$4",
          "$5"
        ]
      }
    },
    {
      "direction": {
        "type": "sequence",
        "value": "$5 * 2.5"
      },
      "speed": {
        "type": "absolute",
        "value": "$2 * 0.6"
      },
      "bulletRef": 2
    },
    {
      "direction": {
        "type": "sequence",
        "value": 0
      },
      "speed": {
        "type": "sequence",
        "value": "$2 * 0.05"
      },
      "bulletRef": 3
    },
    {
      "direction": {
        "type": "sequence",
        "value": 120
      },
      "speed": {
        "type": "absolute",
        "value": "$2 * 0.6"
      },
      "bulletRef": 4
    },
    {
      "direction": {
        "type": "sequence",
        "value": 0
      },
      "speed": {
        "type": "sequence",
        "value": "$2 * 0.05"
      },
      "bulletRef": 5
    },
    {
      "direction": {
        "type": "relative",
        "value": "$3"
      },
      "speed": {
        "type": "absolute",
        "value": "$1"
      },
      "bulletRef": 6
    },
    {
      "direction": {
        "type": "sequence",
        "value": "$4"
      },
      "speed": {
        "type": "sequence",
        "value": "-($1 * 0.1)"
      },
      "bulletRef": 7
    },
    {
      "direction": {
        "type": "sequence",
        "value": "$4"
      },
      "speed": {
        "type": "sequence",
        "value": "($1 * 0.1)"
      },
      "bulletRef": 8
    },
    {
      "bulletRef": {
        "ref": 0,
        "params": [
          2.5,
          "1.2 * (0.5 + 0.5 * $rank)",
          "11 * (3.5 - 2.5 * $rank)",
          0,
          10
        ]
      }
    },
    {
      "bulletRef": {
        "ref": 0,
        "params": [
          1.5,
          "1.5 * (0.5 + 0.5 * $rank)",
          "7 * (3.5 - 2.5 * $rank)",
          0,
          -8
        ]
      }
    },
    {
      "bulletRef": {
        "ref": 0,
        "params": [
          0.5,
          "1.8 * (0.5 + 0.5 * $rank)",
          "5 * (3.5 - 2.5 * $rank)",
          0,
          6
        ]
      }
    }
  ]
}
