{
  "type": "vertical",
  "bullets": [
    {
      "actionRefs": [
        2
      ]
    },
    {
      "actionRefs": [
        3
      ]
    },
    {},
    {
      "actionRefs": [
        4
      ]
    }
  ],
  "actions": [
    [
      {
        "repeat": {
          "times": "5+(20*$rank)",
          "actionRef": 5
        }
      }
    ],
    [
      {
        "fireRef": 2
      },
      {
        "repeat": {
          "times": 7,
          "actionRef": 6
        }
      }
    ],
    [
      {
        "changeSpeed": {
          "speed": {
            "type": "absolute",
            "value": 1.05
          },
          "term": 25
        }
      }
    ],
    [
      {
        "changeSpeed": {
          "speed": {
            "type": "absolute",
            "value": 8.4
          },
          "term": 150
        }
      },
      {
        "wait": 9999
      },
      {
        "fireRef": 1
      }
    ],
    [
      {
        "changeSpeed": {
          "speed": {
            "type": "absolute",
            "value": 0
          },
          "term": 20
        }
      },
      {
        "wait": 20
      },
      {
        "actionRef": 1
      },
      {
        "vanish": true
      }
    ],
    [
      {
        "fireRef": {
          "ref": 0,
          "params": [
            90
          ]
        }
      },
      {
        "fireRef": {
          "ref": 0,
          "params": [
            270
          ]
        }
      },
      {
        "wait": "55-($rank*30)"
      }
    ],
    [
      {
        "fireRef": 3
      },
      {
        "fireRef": 4
      }
    ]
  ],
  "fires": [
    {
      "direction": {
        "type": "absolute",
        "value": "$1"
      },
      "speed": {
        "type": "absolute",
        "value": 2
      },
      "bulletRef": 3
    },
    {
      "bulletRef": 2
    },
    {
      "direction": {
        "type": "aim",
        "value": "$rand*60-30-70"
      },
      "speed": {
        "type": "absolute",
        "value": 4.2
      },
      "bulletRef": 0
    },
    {
      "direction": {
        "type": "sequence",
        "value": 8.5
      },
      "speed": {
        "type": "absolute",
        "value": 1.05
      },
      "bulletRef": 1
    },
    {
      "direction": {
        "type": "sequence",
        "value": 8.5
      },
      "speed": {
        "type": "absolute",
        "value": 4.2
      },
      "bulletRef": 0
    }
  ]
}
