{
  "type": "none",
  "bullets": [
    {
      "actionRefs": [
        3
      ]
    },
    {}
  ],
  "actions": [
    [
      {
        "actionRef": 1
      },
      {
        "actionRef": 2
      }
    ],
    [
      {
        "fireRef": 1
      }
    ],
    [
      {
        "repeat": {
          "times": 3,
          "actionRef": 7
        }
      },
      {
        "wait": 60
      }
    ],
    [
      {
        "repeat": {
          "times": 10,
          "actionRef": 4
        }
      }
    ],
    [
      {
        "accel": {
          "horizontal": {
            "type": "relative",
            "value": "$1*4"
          },
          "term": 20
        }
      },
      {
        "repeat": {
          "times": 10,
          "actionRef": 5
        }
      },
      {
        "accel": {
          "horizontal": {
            "type": "relative",
            "value": "-$1*4"
          },
          "term": 20
        }
      },
      {
        "repeat": {
          "times": 10,
          "actionRef": 6
        }
      }
    ],
    [
      {
        "actionRef": {
          "ref": 1,
          "params": [
            "$1"
          ]
        }
      },
      {
        "wait": 2
      }
    ],
    [
      {
        "actionRef": {
          "ref": 1,
          "params": [
            "$1"
          ]
        }
      },
      {
        "wait": 2
      }
    ],
    [
      {
        "fireRef": {
          "ref": 0,
          "params": [
            1
          ]
        }
      },
      {
        "fireRef": {
          "ref": 0,
          "params": [
            -1
          ]
        }
      },
      {
        "wait": 80
      }
    ]
  ],
  "fires": [
    {
      "direction": {
        "type": "aim",
        "value": "(30+$rank*20)*$1"
      },
      "speed": {
        "type": "absolute",
        "value": 2
      },
      "bulletRef": 0
    },
    {
      "direction": {
        "type": "relative",
        "value": 0
      },
      "speed": {
        "type": "relative",
        "value": -0.5
      },
      "bulletRef": 1
    }
  ]
}
