{
  "type": "none",
  "bullets": [
    {
      "speed": {
        "type": "absolute",
        "value": 3
      },
      "actionRefs": [
        1
      ]
    },
    {
      "speed": {
        "type": "absolute",
        "value": 6
      },
      "actionRefs": [
        5
      ]
    },
    {},
    {},
    {}
  ],
  "actions": [
    [
      {
        "fireRef": 5
      },
      {
        "fireRef": 6
      },
      {
        "wait": 200
      }
    ],
    [
      {
        "wait": 3
      },
      {
        "repeat": {
          "times": 2,
          "actionRef": 2
        }
      },
      {
        "repeat": {
          "times": 2,
          "actionRef": 3
        }
      },
      {
        "repeat": {
          "times": 2,
          "actionRef": 4
        }
      },
      {
        "vanish": true
      }
    ],
    [
      {
        "fireRef": 0
      }
    ],
    [
      {
        "fireRef": 1
      }
    ],
    [
      {
        "fireRef": 2
      }
    ],
    [
      {
        "changeSpeed": {
          "speed": {
            "type": "absolute",
            "value": 0
          },
          "term": 10
        }
      },
      {
        "wait": 10
      },
      {
        "repeat": {
          "times": "4+$rank*6",
          "actionRef": 6
        }
      },
      {
        "vanish": true
      }
    ],
    [
      {
        "fireRef": 3
      },
      {
        "fireRef": 4
      },
      {
        "wait": "200/(4+$rank*6)"
      }
    ]
  ],
  "fires": [
    {
      "direction": {
        "type": "aim",
        "value": "-15+30*$rand"
      },
      "speed": {
        "type": "absolute",
        "value": "0.8+$rank+$rand"
      },
      "bulletRef": 2
    },
    {
      "direction": {
        "type": "aim",
        "value": "-45+30*$rand"
      },
      "speed": {
        "type": "absolute",
        "value": "0.8+$rank+$rand"
      },
      "bulletRef": 3
    },
    {
      "direction": {
        "type": "aim",
        "value": "15+30*$rand"
      },
      "speed": {
        "type": "absolute",
        "value": "0.8+$rank+$rand"
      },
      "bulletRef": 4
    },
    {
      "direction": {
        "type": "aim",
        "value": 90
      },
      "bulletRef": 0
    },
    {
      "direction": {
        "type": "aim",
        "value": -90
      },
      "bulletRef": 0
    },
    {
      "direction": {
        "type": "absolute",
        "value": 90
      },
      "bulletRef": 1
    },
    {
      "direction": {
        "type": "absolute",
        "value": 270
      },
      "bulletRef": 1
    }
  ]
}
