{
  "type": "vertical",
  "bullets": [
    {
      "actionRefs": [
        2
      ]
    },
    {},
    {},
    {
      "actionRefs": [
        4
      ]
    },
    {
      "actionRefs": [
        6
      ]
    },
    {
      "actionRefs": [
        8
      ]
    }
  ],
  "actions": [
    [
      {
        "fireRef": 0
      },
      {
        "repeat": {
          "times": "35+$rank*21",
          "actionRef": 1
        }
      },
      {
        "wait": 110
      }
    ],
    [
      {
        "fireRef": 5
      },
      {
        "repeat": {
          "times": "$rank*6",
          "actionRef": 9
        }
      },
      {
        "fireRef": 7
      },
      {
        "repeat": {
          "times": "$rank*6",
          "actionRef": 10
        }
      },
      {
        "wait": 11
      }
    ],
    [
      {
        "wait": 18
      },
      {
        "fireRef": 3
      },
      {
        "repeat": {
          "times": "7-1",
          "actionRef": 3
        }
      },
      {
        "vanish": true
      }
    ],
    [
      {
        "fireRef": 4
      }
    ],
    [
      {
        "repeat": {
          "times": "3+$rank*7",
          "actionRef": 5
        }
      },
      {
        "vanish": true
      }
    ],
    [
      {
        "fireRef": {
          "ref": 1,
          "params": [
            1,
            1
          ]
        }
      },
      {
        "fireRef": {
          "ref": 1,
          "params": [
            -1,
            1
          ]
        }
      },
      {
        "fireRef": {
          "ref": 1,
          "params": [
            0.5,
            -2
          ]
        }
      },
      {
        "fireRef": {
          "ref": 1,
          "params": [
            -0.5,
            -2
          ]
        }
      },
      {
        "wait": 63
      }
    ],
    [
      {
        "wait": 10
      },
      {
        "changeSpeed": {
          "speed": {
            "type": "absolute",
            "value": 0.5
          },
          "term": 1
        }
      },
      {
        "wait": 1
      },
      {
        "repeat": {
          "times": "4+$rank*5",
          "actionRef": 7
        }
      },
      {
        "vanish": true
      }
    ],
    [
      {
        "fireRef": {
          "ref": 2,
          "params": [
            "$2*$1",
            -1
          ]
        }
      },
      {
        "fireRef": {
          "ref": 2,
          "params": [
            "$2*$1",
            1
          ]
        }
      },
      {
        "wait": 3
      }
    ],
    [],
    [
      {
        "fireRef": 6
      }
    ],
    [
      {
        "fireRef": 8
      }
    ]
  ],
  "fires": [
    {
      "direction": {
        "type": "absolute",
        "value": 180
      },
      "speed": {
        "type": "absolute",
        "value": 0
      },
      "bulletRef": 3
    },
    {
      "direction": {
        "type": "absolute",
        "value": "$1*90"
      },
      "speed": {
        "type": "absolute",
        "value": 2.5
      },
      "bulletRef": 4
    },
    {
      "direction": {
        "type": "aim",
        "value": "($1+$2)*7"
      },
      "speed": {
        "type": "absolute",
        "value": "2.2+$rank*1"
      },
      "bulletRef": 5
    },
    {
      "direction": {
        "type": "relative",
        "value": 0
      },
      "speed": {
        "type": "absolute",
        "value": 1.4
      },
      "bulletRef": 1
    },
    {
      "direction": {
        "type": "sequence",
        "value": "360/7"
      },
      "speed": {
        "type": "absolute",
        "value": 1.4
      },
      "bulletRef": 2
    },
    {
      "direction": {
        "type": "sequence",
        "value": 7
      },
      "speed": {
        "type": "absolute",
        "value": 1.4
      },
      "bulletRef": 0
    },
    {
      "direction": {
        "type": "sequence",
        "value": 0
      },
      "speed": {
        "type": "sequence",
        "value": -0.14
      },
      "bulletRef": 0
    },
    {
      "direction": {
        "type": "sequence",
        "value": 180
      },
      "speed": {
        "type": "absolute",
        "value": 1.4
      },
      "bulletRef": 0
    },
    {
      "direction": {
        "type": "sequence",
        "value": 0
      },
      "speed": {
        "type": "sequence",
        "value": -0.14
      },
      "bulletRef": 0
    }
  ]
}
