{
  "type": "vertical",
  "bullets": [
    {}
  ],
  "actions": [
    [
      {
        "fireRef": 0
      }
    ],
    [
      {
        "actionRef": {
          "ref": 0,
          "params": [
            12,
            "0.5 + $rank"
          ]
        }
      }
    ]
  ],
  "fires": [
    {
      "bulletRef": 0
    }
  ]
}
