{
  "type": "vertical",
  "bullets": [
    {
      "speed": {
        "type": "absolute",
        "value": 0
      },
      "actionRefs": [
        1
      ]
    },
    {
      "speed": {
        "type": "absolute",
        "value": 0
      },
      "actionRefs": [
        3
      ]
    },
    {
      "speed": {
        "type": "absolute",
        "value": 2
      }
    }
  ],
  "actions": [
    [
      {
        "repeat": {
          "times": "4+$rank*10",
          "actionRef": 5
        }
      },
      {
        "wait": 180
      }
    ],
    [
      {
        "repeat": {
          "times": 4,
          "actionRef": 2
        }
      },
      {
        "vanish": true
      }
    ],
    [
      {
        "changeDirection": {
          "direction": {
            "type": "absolute",
            "value": "$rand*360"
          },
          "term": 20
        }
      },
      {
        "changeSpeed": {
          "speed": {
            "type": "absolute",
            "value": 2
          },
          "term": 20
        }
      },
      {
        "wait": 20
      },
      {
        "changeSpeed": {
          "speed": {
            "type": "absolute",
            "value": 0
          },
          "term": 20
        }
      },
      {
        "wait": 20
      },
      {
        "fireRef": 0
      },
      {
        "wait": 0
      }
    ],
    [
      {
        "fireRef": 1
      },
      {
        "repeat": {
          "times": 5,
          "actionRef": 4
        }
      },
      {
        "vanish": true
      }
    ],
    [
      {
        "wait": 6
      },
      {
        "fireRef": 2
      }
    ],
    [
      {
        "fireRef": 3
      }
    ]
  ],
  "fires": [
    {
      "bulletRef": 1
    },
    {
      "direction": {
        "type": "aim",
        "value": "$rand*10-5"
      },
      "bulletRef": 2
    },
    {
      "direction": {
        "type": "sequence",
        "value": 0
      },
      "bulletRef": 2
    },
    {
      "bulletRef": 0
    }
  ]
}
