{
  "type": "vertical",
  "bullets": [
    {
      "direction": {
        "type": "aim",
        "value": 0
      },
      "speed": {
        "type": "absolute",
        "value": 0.5
      },
      "actionRefs": [
        1
      ]
    },
    {
      "speed": {
        "type": "absolute",
        "value": 4
      },
      "actionRefs": [
        4
      ]
    },
    {},
    {},
    {},
    {},
    {},
    {}
  ],
  "actions": [
    [
      {
        "fireRef": 7
      },
      {
        "wait": 450
      }
    ],
    [
      {
        "changeSpeed": {
          "speed": {
            "type": "absolute",
            "value": 1.1
          },
          "term": 120
        }
      },
      {
        "repeat": {
          "times": 4,
          "actionRef": 2
        }
      },
      {
        "vanish": true
      }
    ],
    [
      {
        "repeat": {
          "times": 6,
          "actionRef": 3
        }
      },
      {
        "fireRef": 0
      }
    ],
    [
      {
        "changeDirection": {
          "direction": {
            "type": "aim",
            "value": 0
          },
          "term": 10
        }
      },
      {
        "wait": 10
      }
    ],
    [
      {
        "changeSpeed": {
          "speed": {
            "type": "absolute",
            "value": 0.001
          },
          "term": 30
        }
      },
      {
        "wait": 30
      },
      {
        "changeDirection": {
          "direction": {
            "type": "aim",
            "value": 0
          },
          "term": 1
        }
      },
      {
        "wait": 5
      },
      {
        "fireRef": 1
      },
      {
        "repeat": {
          "times": "4 + 25 * $rank",
          "actionRef": 5
        }
      },
      {
        "wait": 10
      },
      {
        "fireRef": 3
      },
      {
        "repeat": {
          "times": "4 + 25 * $rank",
          "actionRef": 6
        }
      },
      {
        "wait": 10
      },
      {
        "fireRef": 5
      },
      {
        "repeat": {
          "times": "4 + 25 * $rank",
          "actionRef": 7
        }
      },
      {
        "vanish": true
      }
    ],
    [
      {
        "fireRef": 2
      }
    ],
    [
      {
        "fireRef": 4
      }
    ],
    [
      {
        "fireRef": 6
      }
    ]
  ],
  "fires": [
    {
      "direction": {
        "type": "aim",
        "value": "-70 + 20 * $rand"
      },
      "bulletRef": 1
    },
    {
      "direction": {
        "type": "relative",
        "value": -20
      },
      "speed": {
        "type": "absolute",
        "value": 0.7
      },
      "bulletRef": 2
    },
    {
      "direction": {
        "type": "sequence",
        "value": "10 - 8 * $rank"
      },
      "speed": {
        "type": "sequence",
        "value": 0.05
      },
      "bulletRef": 3
    },
    {
      "direction": {
        "type": "relative",
        "value": 0
      },
      "speed": {
        "type": "absolute",
        "value": 0.7
      },
      "bulletRef": 4
    },
    {
      "direction": {
        "type": "sequence",
        "value": "10 - 8 * $rank"
      },
      "speed": {
        "type": "sequence",
        "value": 0.05
      },
      "bulletRef": 5
    },
    {
      "direction": {
        "type": "relative",
        "value": 20
      },
      "speed": {
        "type": "absolute",
        "value": 0.7
      },
      "bulletRef": 6
    },
    {
      "direction": {
        "type": "sequence",
        "value": "10 - 8 * $rank"
      },
      "speed": {
        "type": "sequence",
        "value": 0.05
      },
      "bulletRef": 7
    },
    {
      "bulletRef": 0
    }
  ]
}
