{
  "type": "vertical",
  "bullets": [
    {},
    {
      "actionRefs": [
        5
      ]
    },
    {},
    {
      "actionRefs": [
        7
      ]
    },
    {}
  ],
  "actions": [
    [
      {
        "actionRef": 1
      },
      {
        "actionRef": 2
      },
      {
        "actionRef": 3
      }
    ],
    [
      {
        "repeat": {
          "times": 2,
          "actionRef": 4
        }
      }
    ],
    [
      {
        "fireRef": 1
      },
      {
        "repeat": {
          "times": 150,
          "actionRef": 6
        }
      }
    ],
    [
      {
        "fireRef": 3
      },
      {
        "repeat": {
          "times": 150,
          "actionRef": 8
        }
      }
    ],
    [
      {
        "fireRef": 0
      }
    ],
    [
      {
        "vanish": true
      }
    ],
    [
      {
        "fireRef": 2
      },
      {
        "actionRef": 1
      },
      {
        "wait": "4-$rank*2+$rand"
      }
    ],
    [
      {
        "vanish": true
      }
    ],
    [
      {
        "fireRef": 4
      },
      {
        "actionRef": 1
      },
      {
        "wait": "4-$rank*2+$rand"
      }
    ]
  ],
  "fires": [
    {
      "direction": {
        "type": "sequence",
        "value": 9
      },
      "speed": {
        "type": "sequence",
        "value": 0
      },
      "bulletRef": 0
    },
    {
      "direction": {
        "type": "absolute",
        "value": 9
      },
      "bulletRef": 1
    },
    {
      "direction": {
        "type": "sequence",
        "value": "7-18"
      },
      "speed": {
        "type": "absolute",
        "value": 1.8
      },
      "bulletRef": 2
    },
    {
      "direction": {
        "type": "absolute",
        "value": 9
      },
      "bulletRef": 3
    },
    {
      "direction": {
        "type": "sequence",
        "value": "-7-18"
      },
      "speed": {
        "type": "absolute",
        "value": 1.8
      },
      "bulletRef": 4
    }
  ]
}
